slug,provider,offer,actionButtons,toolType,programmingLanguage,tag,description,planType,planName,price,trial,starred,dependencies,latestKnownVersion,latestKnownReleaseDate,maintainer,license
0x-cert,0xCert,,"[""[Website](https://github.com/0xcert/framework/)""]",Framework,JavaScript,"[""0xcert"",""Blockchain"",""dApp"",""Decentralized applications""]","Provides a comprehensive suite of tools for building decentralized applications that manage digital assets, specifically non-fungible tokens and fungible tokens, across multiple blockchains",Free,,$0,FALSE,FALSE,,TBD,TBD,TBD,TBD
alchemy-sdk-enterprise,Alchemy,SDK,"[""[Contact](https://www.alchemy.com/contact-sales)"",""[Docs](https://www.alchemy.com/docs)""]",SDK,TBD,"[""Web3 development"",""Blockchain developer tools"",""Ethereum development"",""dApp development""]","It is a powerful JavaScript/TypeScript library that serves as the core of Alchemy's comprehensive web3 development platform, allowing developers to easily connect their decentralized applications to various blockchains and leverage enhanced developer tools and infrastructure",Enterprise,,Custom,FALSE,FALSE,,TBD,TBD,TBD,TBD
alchemy-sdk-free,Alchemy,SDK,"[""[Docs](https://www.alchemy.com/docs)""]",SDK,TBD,"[""Web3 development"",""Blockchain developer tools"",""Ethereum development"",""dApp development""]","It is a powerful JavaScript/TypeScript library that serves as the core of Alchemy's comprehensive web3 development platform, allowing developers to easily connect their decentralized applications to various blockchains and leverage enhanced developer tools and infrastructure",Free,,$0,FALSE,FALSE,,TBD,TBD,TBD,TBD
alchemy-sdk-pay-as-you-go,Alchemy,SDK,"[""[Buy](https://www.alchemy.com/pricing)"",""[Docs](https://www.alchemy.com/docs)""]",SDK,TBD,"[""Web3 development"",""Blockchain developer tools"",""Ethereum development"",""dApp development""]","It is a powerful JavaScript/TypeScript library that serves as the core of Alchemy's comprehensive web3 development platform, allowing developers to easily connect their decentralized applications to various blockchains and leverage enhanced developer tools and infrastructure",Pay-as-you-go,,$5/$45/$215/$415/$815/$2K per 11M/100M/500M/1B/2B/5B CUs,FALSE,FALSE,,TBD,TBD,TBD,TBD
ankr-sdk,Ankr,SDK,"[""[Docs](https://www.ankr.com/docs/advanced-api/javascript-sdk/)""]",SDK,JavaScript,"[""Ankr.js SDK"",""Ankr.py SDK"",""Advanced API""]","It offers compact libraries for querying RPC endpoints, fetching NFT/token data, transaction histories, and more via Ankr's global node infrastructure",Free,,$0,FALSE,FALSE,,TBD,TBD,TBD,MIT
anyalt,AnyAlt,,"[""[Website](https://www.anyalt.finance/)"",""[Docs](https://docs.anyalt.finance/sdk/overview)""]",SDK,TBD,"[""Cross-chain functionality"",""SDKs"",""APIs""]","Provides developers with an SDK and a pre-built widget to integrate cross-chain and last-mile transactions, including fiat-to-crypto on-ramps, into blockchain protocols and web3 projects",Free,,$0,FALSE,FALSE,,TBD,TBD,TBD,TBD
assembly-script,AssemblyScript,,"[""[Website](https://www.assemblyscript.org/introduction.html)""]",SDK,TBD,"[""WebAssembly"",""TypeScript"",""JavaScript""]",It offers a compiler and toolchain allowing developers to write high-performance code in a TypeScript-like language and compile it to WebAssembly,Free,,$0,FALSE,FALSE,,TBD,TBD,TBD,TBD
axelar-sdk,Axelar,SDK,"[""[Docs](https://docs.axelar.dev/dev/axelarjs-sdk/intro/)""]",SDK,JavaScript,"[""Cross-chain communication"",""Interoperability"",""AxelarJS SDK""]",SDK for integrating cross-chain token transfers and general message passing using Axelars decentralized interoperability network,Free,,$0,FALSE,FALSE,,TBD,TBD,TBD,Apache-2.0
aztec-sdk-free,Aztec,,"[""[Docs](https://docs.aztec.network/developers/docs/aztec-js)""]",SDK,TBD,"[""Zero-Knowledge Proofs"",""Privacy-first /Confidential transactions"",""Ethereum Layer 2""]","It provides SDK, documentation, testnet access and especially Noir, a Rust-like programming language for writing zero-knowledge smart contracts",Free,,$0 ,FALSE,FALSE,,TBD,TBD,TBD,TBD
biconomy,Biconomy,,"[""[Docs](https://docs.biconomy.io/)""]",SDK,TypeScript,"[""Gasless transactions"",""Relayer"",""AbstractJS SDK""]","Multichain relayer infrastructure offering gasless transactions, transaction batching and other features to simplify Web3 UX and onboarding",Enterprise,,Custom,FALSE,FALSE,,TBD,TBD,TBD,TBD
blockdaemon-sdk-enterprise,Blockdaemon,Staking SDK,"[""[GitLab](https://gitlab.com/Blockdaemon/open-source/staking-sdk/-/tree/dev/libs/ts/staking-sdk-eth)"",""[Contact](https://www.blockdaemon.com/api/pricing)""]",SDK,TypeScript,"[""Web3 Gateway"",""Institutional Grade Blockchain"",""Scalable Blockchain Solutions"",""Multi-Protocol Support""]","It provides an extensive toolkit, including REST and RPC APIs and SDKs, for developers to build Web3 applications and integrate with various blockchain networks",Enterprise,,Custom,FALSE,FALSE,,TBD,TBD,TBD,TBD
blockdaemon-sdk-free,Blockdaemon,Staking SDK,"[""[GitLab](https://gitlab.com/Blockdaemon/open-source/staking-sdk/-/tree/dev/libs/ts/staking-sdk-eth)"",""[Docs](https://docs.blockdaemon.com/reference/staking-sdk)""]",SDK,TypeScript,"[""Web3 Gateway"",""Institutional Grade Blockchain"",""Scalable Blockchain Solutions"",""Multi-Protocol Support""]","It provides an extensive toolkit, including REST and RPC APIs and SDKs, for developers to build Web3 applications and integrate with various blockchain networks",Free,,$0,FALSE,FALSE,,TBD,TBD,TBD,TBD
blockdaemon-sdk-growth,Blockdaemon,Staking SDK,"[""[GitLab](https://gitlab.com/Blockdaemon/open-source/staking-sdk/-/tree/dev/libs/ts/staking-sdk-eth)"",""[Contact](https://www.blockdaemon.com/api/pricing)""]",SDK,TypeScript,"[""Web3 Gateway"",""Institutional Grade Blockchain"",""Scalable Blockchain Solutions"",""Multi-Protocol Support""]","It provides an extensive toolkit, including REST and RPC APIs and SDKs, for developers to build Web3 applications and integrate with various blockchain networks",Tiered,Growth,Custom,FALSE,FALSE,,TBD,TBD,TBD,TBD
blockdaemon-sdk-starter,Blockdaemon,Staking SDK,"[""[GitLab](https://gitlab.com/Blockdaemon/open-source/staking-sdk/-/tree/dev/libs/ts/staking-sdk-eth)"",""[Contact](https://www.blockdaemon.com/api/pricing)""]",SDK,TypeScript,"[""Web3 Gateway"",""Institutional Grade Blockchain"",""Scalable Blockchain Solutions"",""Multi-Protocol Support""]","It provides an extensive toolkit, including REST and RPC APIs and SDKs, for developers to build Web3 applications and integrate with various blockchain networks",Tiered,Starter,Custom,FALSE,FALSE,,TBD,TBD,TBD,TBD
brownie,Brownie,,"[""[Website](https://github.com/eth-brownie/brownie)""]",Framework,Python,"[""Smart contract development""]","It provides developers with a robust set of tools to write, test, debug, and deploy smart contracts using the Python programming language instead of JavaScript/TypeScript, which is more common in Web3 development",Free,,$0,FALSE,FALSE,,TBD,TBD,TBD,TBD
capstone-disassembler,Capstone Disassembler,,"[""[Website](https://github.com/crytic/pyevmasm)""]",Library,TBD,"[""EVM assembler library"",""EVM disassembler"",""Assemble EVM instructions"",""EVM bytecode generation""]",It provides the granular control and visibility needed to work directly with the low-level machine code that powers smart contracts on Ethereum and other EVM-compatible blockchains,Free,,$0,FALSE,FALSE,,TBD,TBD,TBD,TBD
chainbase-sdk-developer,Chainbase,,"[""[Buy](https://platform.chainbase.com/pricing)""]",SDK,JavaScript,"[""Multi-Chain Data Platform"",""Blockchain Developer Tools"",""Blockchain Data API"",""On-Chain Data Analytics""]","It provides a full suite of tools and SDKs to help developers build Web3 applications more efficiently, including a console for creating, debugging and managing projects",Tiered,Developer,$99/mo,FALSE,TRUE,,TBD,TBD,TBD,TBD
chainbase-sdk-enterprise,Chainbase,,"[""[Contact](https://platform.chainbase.com/contact)""]",SDK,JavaScript,"[""Multi-Chain Data Platform"",""Blockchain Developer Tools"",""Blockchain Data API"",""On-Chain Data Analytics""]","It provides a full suite of tools and SDKs to help developers build Web3 applications more efficiently, including a console for creating, debugging and managing projects",Enterprise,,Custom,FALSE,TRUE,,TBD,TBD,TBD,TBD
chainbase-sdk-free,Chainbase,,"[""[Docs](https://docs.chainbase.com/introduction/networks/developers)""]",SDK,JavaScript,"[""Multi-Chain Data Platform"",""Blockchain Developer Tools"",""Blockchain Data API"",""On-Chain Data Analytics""]","It provides a full suite of tools and SDKs to help developers build Web3 applications more efficiently, including a console for creating, debugging and managing projects",Free,,$0 ,FALSE,TRUE,,TBD,TBD,TBD,TBD
connectkit,ConnectKit,,"[""[Website](https://family.co/docs/connectkit)""]",Library,TypeScript,"[""Wallet Connect"",""Web3 wallet"",""React Component Library""]",React component library for Web3 frontend developers that simplifies the process of connecting a user's cryptocurrency wallet to a decentralized application,Free,,$0,FALSE,FALSE,,TBD,TBD,TBD,TBD
dappkit,Dappkit,,"[""[Website](https://dappkit.dev/)""]",SDK,TBD,"[""dApp development"",""Web3 SDK"",""Blockchain development"",""Smart contract interaction""]","It is a free, open-source Software Development Kit and platform that streamlines the creation and integration of web3 applications by providing pre-built tools, components, and code libraries",Free,,$0,FALSE,FALSE,,TBD,TBD,TBD,TBD
db3-js,db3.js,,"[""[Docs](https://docs.db3.network/)""]",SDK,JavaScript,"[""Decentralized Database"",""Blockchain"",""InterPlanetary File System"",""Arweave""]",It provides a collection of JavaScript and TypeScript libraries for developers to connect and interact with Ethereum and other EVM-compatible blockchain nodes,Free,,$0 ,FALSE,FALSE,,TBD,TBD,TBD,TBD
dfns-sdk-basic,Dfns,SDK,"[""[Buy](https://www.dfns.co/pricing)"",""[Docs](https://docs.dfns.co/sdks)"" ]",SDK,TypeScript,"[""Wallet-as-a-Service"",""Key Management"",""Account Abstraction""]","An institutional-grade Wallet-as-a-Service (WaaS) and digital asset infrastructure platform offering comprehensive SDKs for secure, programmable wallet management across dozens of blockchains.",Tiered,Basic,$600/mo,TRUE,FALSE,,TBD,TBD,TBD,TBD
dfns-sdk-enterprise,Dfns,SDK,"[""[Contact](https://www.dfns.co/pricing)"",""[Docs](https://docs.dfns.co/sdks)"" ]",SDK,TypeScript,"[""Wallet-as-a-Service"",""Key Management"",""Account Abstraction""]","An institutional-grade Wallet-as-a-Service (WaaS) and digital asset infrastructure platform offering comprehensive SDKs for secure, programmable wallet management across dozens of blockchains.",Enterprise,,Custom,TRUE,FALSE,,TBD,TBD,TBD,TBD
dfns-sdk-pro,Dfns,SDK,"[""[Buy](https://www.dfns.co/pricing)"",""[Docs](https://docs.dfns.co/sdks)"" ]",SDK,TypeScript,"[""Wallet-as-a-Service"",""Key Management"",""Account Abstraction""]","An institutional-grade Wallet-as-a-Service (WaaS) and digital asset infrastructure platform offering comprehensive SDKs for secure, programmable wallet management across dozens of blockchains.",Tiered,Pro,$2.8K/mo,TRUE,FALSE,,TBD,TBD,TBD,TBD
dfns-sdk-starter,Dfns,SDK,"[""[Buy](https://www.dfns.co/pricing)"",""[Docs](https://docs.dfns.co/sdks)"" ]",SDK,TypeScript,"[""Wallet-as-a-Service"",""Key Management"",""Account Abstraction""]","An institutional-grade Wallet-as-a-Service (WaaS) and digital asset infrastructure platform offering comprehensive SDKs for secure, programmable wallet management across dozens of blockchains.",Tiered,Starter,$60/mo,TRUE,FALSE,,TBD,TBD,TBD,TBD
dynamic-sdk-enterprise,Dynamic,SDK,"[""[Website](https://www.dynamic.xyz/sdk)"",""[Docs](https://www.dynamic.xyz/docs/unity/sdk-reference/overview)""]",SDK,TypeScript,"[""Web3 Onboarding"",""Wallet Integration"",""Authentication""]",Developer toolkit for embedding non-custodial wallets and frictionless user onboarding across multiple networks without complex backend infrastructure.,Enterprise,Custom,Custom,FALSE,FALSE,,TBD,TBD,Dynamic,TBD
dynamic-sdk-free,Dynamic,SDK,"[""[Website](https://www.dynamic.xyz/sdk)"",""[Docs](https://www.dynamic.xyz/docs/unity/sdk-reference/overview)""]",SDK,TypeScript,"[""Web3 Onboarding"",""Wallet Integration"",""Authentication""]",Developer toolkit for embedding non-custodial wallets and frictionless user onboarding across multiple networks without complex backend infrastructure.,Free,Starter,$0,FALSE,FALSE,,TBD,TBD,Dynamic,TBD
dynamic-sdk-growth,Dynamic,SDK,"[""[Website](https://www.dynamic.xyz/sdk)"",""[Docs](https://www.dynamic.xyz/docs/unity/sdk-reference/overview)""]",SDK,TypeScript,"[""Web3 Onboarding"",""Wallet Integration"",""Authentication""]",Developer toolkit for embedding non-custodial wallets and frictionless user onboarding across multiple networks without complex backend infrastructure.,Tiered,Growth,$249/mo,FALSE,FALSE,,TBD,TBD,Dynamic,TBD
embark,Embark,,"[""[Website](https://github.com/embarklabs/embark)""]",Framework,Rust,"[""Game Development"",""Game Engine"",""Open Source Tools"",""Rendering""]","It provides tools for developing smart contracts, integrating with blockchain platforms like Ethereum and connecting to decentralized storage and communication platforms",Free,,$0 ,FALSE,FALSE,,TBD,TBD,TBD,TBD
ens-js,ENSjs,,"[""[Website](https://github.com/ensdomains/ensjs?tab=readme-ov-file)""]",Library,JavaScript,"[""Ethereum Name Service"",""ENS Domains"",""Web3 Development""]",It allows developers to interact with the Ethereum Name Service smart contracts and infrastructure,Free,,$0 ,FALSE,FALSE,,TBD,TBD,TBD,TBD
eth-tx,EthTx,,"[""[Website](https://github.com/EthTx/ethtx)""]",Library,Python,"[""Ethereum transaction decoder"",""Blockchain transaction analysis""]","It is a developer and analyst tool that decodes Ethereum transactions into a human-readable format, providing valuable insights into the underlying smart contract logic and token flows",Free,,$0,FALSE,FALSE,,TBD,TBD,TBD,TBD
ethers-js,Ethers.js,,"[""[Website](https://docs.ethers.org/v6/)""]",Library,JavaScript,"[""Library"",""dApp development""]",It is a comprehensive JavaScript and TypeScript toolkit that provides developers with a robust and simple way to interact with the Ethereum blockchain and its broader ecosystem,Free,,$0,FALSE,FALSE,,TBD,TBD,TBD,TBD
etherspot,Etherspot Prime,SDK,"[""[Website](https://etherspot.io)"", ""[Docs](https://etherspot.fyi/prime-sdk/intro)""]",SDK,TBD,"[""Account Abstraction"",""Wallet SDK""]",Account Abstraction SDK providing Web2-like smart wallet experiences i.e social logins batched transactions to Ethereum dApps,Free,,$0,FALSE,FALSE,,TBD,TBD,TBD,TBD
evmole,Evmole,,"[""[Website](https://github.com/cdump/evmole)""]",Library,TBD,"[""EVM Bytecode Analysis"",""Smart Contract Analysis"",""ABI Extraction"",""Function Selector Decoding""]","It provides a library for extracting function selectors, arguments, and other key information from Ethereum Virtual Machine (EVM) bytecode, even for unverified smart contracts",Enterprise,,Custom,FALSE,FALSE,,TBD,TBD,TBD,TBD
foundry,Foundry,,"[""[Docs](https://book.getfoundry.sh/)""]",Framework,Rust,"[""Framework""]",Solidity-native smart contract development toolkit written in Rust offering blazing-fast compilation and testing,Free,,$0,FALSE,FALSE,,TBD,TBD,TBD,TBD
fuzzlib,Fuzzlib,,"[""[Website](https://github.com/perimetersec/fuzzlib)""]",Library,Solidity,"[""Fuzz Testing"",""Software Testing"",""Security Testing"",""Vulnerability Research""]",It helps Web3 developers enhance the security and stability of their smart contracts by streamlining the fuzzing process,Free,,$0,FALSE,FALSE,,TBD,TBD,TBD,TBD
ginco-sdk-enterprise,Ginco,SDK,"[""[Website](https://www.ginco.com/wallet-builder)""]",SDK,TBD,"[""Web3 SDK"",""Blockchain Development Kit"",""Crypto Wallet SDK"",""Non-Custodial Wallet SDK""]","It is specifically designed to help businesses integrate blockchain functionalities, such as digital asset wallets and transaction monitoring, into their own services",Enterprise,,Custom,FALSE,FALSE,,TBD,TBD,TBD,TBD
halliday-sdk,Halliday,,"[""[Docs](https://docs.halliday.xyz/pages/payments-sdk-docs)""]",Onramp,JavaScript,"[""Payments SDK Widget""]","It enables developers to integrate a widget for seamless cryptocurrency payments, including fiat onramps, cross-chain swaps, and exchange withdrawals to any token or chain",Free,,$0,FALSE,FALSE,,TBD,TBD,TBD,TBD
hardhat,Hardhat,,"[""[Docs](https://hardhat.org/docs)""]",Framework,JavaScript,"[""Framework""]",Versatile Ethereum development framework simplifying smart contract building testing and deployment,Free,,$0,FALSE,FALSE,,TBD,TBD,TBD,TBD
huff,Huff,,"[""[Website](https://huff.sh/)""]",Programming Language,Huff,"[""EVM programming language"",""Ethereum smart contracts"",""Low-level smart contract language""]",It is a low-level programming language and associated ecosystem of developer tools used for writing extremely optimized smart contracts on the Ethereum Virtual Machine,Free,,$0,FALSE,FALSE,,TBD,TBD,TBD,TBD
huffmate,Huffmate,,"[""[Website](https://github.com/huff-language/huffmate)""]",Library,Huff,"[""Huff-language"",""Smart-contracts"",""Solidity-tools""]","It provides a library of hyper-optimized Huff smart contracts intended as resources for learning and implementation, rather than a compiler or debugger",Free,,$0,FALSE,FALSE,,TBD,TBD,TBD,TBD
hyperlane-sdk,Hyperlane,SDK,"[""[Docs](https://docs.hyperlane.xyz/docs/reference/developer-tools/typescript-sdk/overview)""]",SDK,TypeScript,"[""Cross-chain messaging"",""Interoperability"",""Multi-chain apps""]",SDK for building applications that send messages and assets across different blockchain networks using Hyperlanes interoperability protocol,Free,,$0,FALSE,FALSE,,TBD,TBD,TBD,Apache-2.0
layerzero-sdk,LayerZero Labs,SDK,"[""[Docs](https://docs.layerzero.network/v2/tools/sdks/options)""]",SDK,Solidity,"[""Message Execution Options"",""LayerZero Solana SDK"",""LayerZero Endpoint Metadata""]",SDK enabling developers to build and debug omnichain applications that communicate across multiple blockchains through LayerZeros messaging protocol,Free,,$0,FALSE,FALSE,,TBD,TBD,TBD,MIT
lens-sdk,Lens,,"[""[Website](https://github.com/lens-protocol/lens-sdk)""]",SDK,TBD,"[""Decentralized Social Graph"",""Social Network"",""dApp Development"",""Developer Tools"",""Social Features""]","It offers developers the infrastructure and tools required to build decentralized social media applications on the Lens Protocol, a decentralized social graph on the Polygon blockchain",Free,,$0,FALSE,FALSE,,TBD,TBD,TBD,TBD
lifi-sdk,LI.FI,SDK,"[""[Docs](https://docs.li.fi/sdk/overview)""]",SDK,TypeScript,"[""DEX aggregation"",""Cross-chain bridging"",""Multi-chain DeFi""]",It provides a powerful toolkit for developers to enable seamless cross-chain and on-chain swaps and bridging within their applications,Free,,$0,FALSE,FALSE,,TBD,TBD,TBD,MIT
loop-decoder,Loop Decoder,,"[""[Website](https://github.com/3loop/loop-decoder)""]",Library,TBD,"[""Code Debugger"",""Developer Tool"",""Code Analysis Tool""]",It offers an all-in-one toolkit designed to simplify Ethereum Virtual Machine (EVM) transaction decoding for web3 developers,Enterprise,,Custom,FALSE,FALSE,,TBD,TBD,TBD,TBD
magic,Magic,,"[""[Website](https://magic.link/)""]",SDK,TBD,"[""Email login"",""Social logins"",""Wallet SDK""]",Web3 onboarding SDK for creating non-custodial wallets using familiar Web2 logins eliminating seed phrases,Free,,$0,FALSE,FALSE,,TBD,TBD,TBD,TBD
matic-js,Matic.js,,"[""[Website](https://github.com/0xPolygon/matic.js)""]",SDK,JavaScript,"[""SDK""]",Official JavaScript SDK for cross-chain bridging and asset management on Polygon,Free,,$0,FALSE,FALSE,,TBD,TBD,TBD,TBD
moralis-sdk-javascript,Moralis,SDK,"[""[Docs](https://docs.moralis.com/get-started/tutorials/streams/wallet-monitoring/monitor-wallet-activity-in-real-time#step-1-install-the-moralis-sdk)""]",SDK,JavaScript,"[""Web3 APIs"",""Multi-chain data"",""Blockchain infrastructure""]",It enables developers to integrate Web3 features into dApps efficiently by simplifying blockchain interactions across chains like EVM and Solana,Free,,$0,TRUE,FALSE,,TBD,TBD,TBD,MIT
moralis-sdk-python,Moralis,SDK,"[""[Docs](https://docs.moralis.com/get-started/tutorials/streams/wallet-monitoring/monitor-wallet-activity-in-real-time#step-1-install-the-moralis-sdk)""]",SDK,Python,"[""Web3 APIs"",""Multi-chain data"",""Blockchain infrastructure""]",It enables developers to integrate Web3 features into dApps efficiently by simplifying blockchain interactions across chains like EVM and Solana,Free,,$0,TRUE,FALSE,,TBD,TBD,TBD,MIT
ocean-protocol-sdk,Ocean Protocol,,"[""[Docs](https://docs.oceanprotocol.com/developers)""]",SDK,TBD,"[""Decentralized Data"",""Data Monetization"",""Data Exchange"",""Data Sharing"",""Blockchain Protocol"",""Data Marketplace""]","It provides developers with a decentralized platform and a comprehensive toolkit for building data-driven applications and marketplaces, focusing on secure, privacy-preserving data sharing and monetization",Free,,$0,FALSE,FALSE,,TBD,TBD,TBD,TBD
onchain-kit,Coinbase,,"[""[Website](https://www.coinbase.com/blog/a-simple-guide-to-the-web3-developer-stack)""]",SDK,TBD,"[""Onchain Commerce"",""NFT minting"",""Funding flow"",""Social profile"" ]",Go-to SDK for building onchain applications with pre-built templates,Free,,$0,FALSE,FALSE,,TBD,TBD,TBD,TBD
onchain-test-kit,Coinbase,,"[""[Website](https://www.coinbase.com/developer-platform/solutions/account-abstraction-kit)""]",Framework,TBD,"[""Testing"",""Framework""]",End-to-end testing framework for blockchain apps,Free,,$0,FALSE,FALSE,,TBD,TBD,TBD,TBD
one-key-sdk,OneKey,SDK,"[""[Website](https://developer.onekey.so/)""]",dApp integration tools for developers,TBD,"[""Hardware Wallet Integration"",""Multi-Chain dApp Connectivity""]",It provides a platform for developers to integrate secure blockchain wallet functionalities into both web and native applications,Free,,$0,FALSE,FALSE,,TBD,TBD,TBD,TBD
open-zeppelin-test-helpers,OpenZeppelin,,"[""[Docs](https://docs.openzeppelin.com/)""]",Library,Solidity,"[""Solidity Test"",""Smart Contract Testing"",""Assertion library""]","It integrates with development environments like Hardhat and Web3.js to offer powerful, configurable checks for secure contract launches, acting as a key part of OpenZeppelin's broader mission to enhance blockchain security",Free,,$0,FALSE,FALSE,,TBD,TBD,TBD,TBD
openzeppelin,OpenZeppelin,,"[""[Docs](https://docs.openzeppelin.com/contracts)""]",Library,Solidity,"[""Security"",""Contracts Library""]","Library of secure community-vetted smart contracts i.e ERC20, ERC721 etc. for Ethereum development",Free,,$0,FALSE,FALSE,,TBD,TBD,TBD,TBD
phantom-sdk,Phantom,SDK,"[""[Docs](https://docs.phantom.com/introduction)""]",Software Development Kit,TBD,"[""Web3 Development"",""Multichain Wallet Integration""]",It provides developers with tools to integrate the Phantom cryptocurrency wallet into their web and mobile applications,Free,,$0,FALSE,FALSE,,TBD,TBD,TBD,TBD
pinata-sdk-enterprise,Pinata,SDK,"[""[Contact](https://pinata.cloud/pricing)"",""[Docs](https://docs.pinata.cloud/sdk/getting-started)""]",SDK,TypeScript,"[""IPFS"",""Decentralized Storage"",""Web3 infrastructure""]","Provides a comprehensive SDK suite for developers to seamlessly upload, manage, and retrieve files on the IPFS decentralized storage network with enterprise-grade gateways.",Enterprise,,Custom,FALSE,FALSE,,TBD,TBD,TBD,TBD
pinata-sdk-fiesta,Pinata,SDK,"[""[Buy](https://pinata.cloud/pricing)"",""[Docs](https://docs.pinata.cloud/sdk/getting-started)""]",SDK,TypeScript,"[""IPFS"",""Decentralized Storage"",""Web3 infrastructure""]","Provides a comprehensive SDK suite for developers to seamlessly upload, manage, and retrieve files on the IPFS decentralized storage network with enterprise-grade gateways.",Tiered,Fiesta,$100/mo,FALSE,FALSE,,TBD,TBD,TBD,TBD
pinata-sdk-free,Pinata,SDK,"[""[Website](https://pinata.cloud/)"",""[Docs](https://docs.pinata.cloud/sdk/getting-started)""]",SDK,TypeScript,"[""IPFS"",""Decentralized Storage"",""Web3 infrastructure""]","Provides a comprehensive SDK suite for developers to seamlessly upload, manage, and retrieve files on the IPFS decentralized storage network with enterprise-grade gateways.",Free,,$0,FALSE,FALSE,,TBD,TBD,TBD,TBD
pinata-sdk-picnic,Pinata,SDK,"[""[Buy](https://pinata.cloud/pricing)"",""[Docs](https://docs.pinata.cloud/sdk/getting-started)""]",SDK,TypeScript,"[""IPFS"",""Decentralized Storage"",""Web3 infrastructure""]","Provides a comprehensive SDK suite for developers to seamlessly upload, manage, and retrieve files on the IPFS decentralized storage network with enterprise-grade gateways.",Tiered,Picnic,$20/mo,FALSE,FALSE,,TBD,TBD,TBD,TBD
prb-test,PRB Test,,"[""[Website](https://github.com/PaulRBerg/prb-test)""]",Library,Solidity,"[""Solidity Testing Library""]","It is a modern collection of testing assertions and logging utilities for Solidity, and is meant to be a drop-in replacement for DSTest",Free,,$0,FALSE,FALSE,,TBD,TBD,TBD,TBD
quicknode-sdk-accelerate,QuickNode,SDK,"[""[Buy](https://www.quicknode.com/pricing)"",""[Docs](https://www.quicknode.com/docs/quicknode-sdk)""]",SDK,TBD,"[""QuickNode SDK"",""Web3 development"",""Blockchain API"",""Node provider""]",It is an open-source software development kit designed to help developers build decentralized applications (dApps) by abstracting complex blockchain interactions and providing an interface to QuickNode's infrastructure,Tiered,Accelerate,$249/mo,FALSE,FALSE,,TBD,TBD,TBD,TBD
